{
  "schema_version": "1.0",
  "event_id": "d1111111-1111-4111-8111-111111111111",
  "occurred_at": "2026-03-10T18:43:17Z",
  "surface": "library",
  "operation": "expand_context",
  "status": "success",
  "session_id": "session-order-debug-001",
  "task_id": "task-order-debug-001",
  "actor_id": "planner_agent",
  "tenant_id": "tenant-001",
  "root_path_hash": "4f4df36dd979de0b7c6a5b4f2176fa4c2fbb0b3e9d1ec6f7d2d5d77f6b3722d2",
  "latency_ms": 6,
  "selected_units_count": 3,
  "result_status": "completed",
  "payload": {
    "stage_name": "expand",
    "stage_result_status": "completed",
    "reserved_tokens": 300,
    "estimated_tokens": 248,
    "returned_tokens": 224,
    "within_budget": true,
    "truncation_count": 0,
    "impact_hints_present": true
  }
}
